doc_id,arxiv_id,title,abstract,authors,published,updated,primary_category,domain,topic_id,topic,source_url,query
D0123,2107.09928v1,Multimodal Representations Learning and Adversarial Hypergraph Fusion for Early Alzheimer's Disease Prediction,"Multimodal neuroimage can provide complementary information about the dementia, but small size of complete multimodal data limits the ability in representation learning. Moreover, the data distribution inconsistency from different modalities may lead to ineffective fusion, which fails to sufficiently explore the intra-modal and inter-modal interactions and compromises the disease diagnosis performance. To solve these problems, we proposed a novel multimodal representation learning and adversarial hypergraph fusion (MRL-AHF) framework for Alzheimer's disease diagnosis using complete trimodal images. First, adversarial strategy and pre-trained model are incorporated into the MRL to extract latent representations from multimodal data. Then two hypergraphs are constructed from the latent representations and the adversarial network based on graph convolution is employed to narrow the distribution difference of hyperedge features. Finally, the hyperedge-invariant features are fused for disease prediction by hyperedge convolution. Experiments on the public Alzheimer's Disease Neuroimaging Initiative(ADNI) database demonstrate that our model achieves superior performance on Alzheimer's disease detection compared with other related models and provides a possible way to understand the underlying mechanisms of disorder's progression by analyzing the abnormal brain connections.",Qiankun Zuo; Baiying Lei; Yanyan Shen; Yong Liu; Zhiguang Feng; Shuqiang Wang,2021-07-21T08:08:05Z,2021-07-21T08:08:05Z,cs.CV,Healthcare_AI,T013,Early detection of Alzheimer’s disease using multimodal learning,http://arxiv.org/abs/2107.09928v1,all:early AND all:detection AND all:alzheimer AND all:disease AND all:multimodal
D0124,2408.16343v2,Toward Robust Early Detection of Alzheimer's Disease via an Integrated Multimodal Learning Approach,"Alzheimer's Disease (AD) is a complex neurodegenerative disorder marked by memory loss, executive dysfunction, and personality changes. Early diagnosis is challenging due to subtle symptoms and varied presentations, often leading to misdiagnosis with traditional unimodal diagnostic methods due to their limited scope. This study introduces an advanced multimodal classification model that integrates clinical, cognitive, neuroimaging, and EEG data to enhance diagnostic accuracy. The model incorporates a feature tagger with a tabular data coding architecture and utilizes the TimesBlock module to capture intricate temporal patterns in Electroencephalograms (EEG) data. By employing Cross-modal Attention Aggregation module, the model effectively fuses Magnetic Resonance Imaging (MRI) spatial information with EEG temporal data, significantly improving the distinction between AD, Mild Cognitive Impairment, and Normal Cognition. Simultaneously, we have constructed the first AD classification dataset that includes three modalities: EEG, MRI, and tabular data. Our innovative approach aims to facilitate early diagnosis and intervention, potentially slowing the progression of AD. The source code and our private ADMC dataset are available at https://github.com/JustlfC03/MSTNet.",Yifei Chen; Shenghao Zhu; Zhaojie Fang; Chang Liu; Binfeng Zou; Yuhe Wang; Shuo Chang; Fan Jia; Feiwei Qin; Jin Fan; Yong Peng; Changmiao Wang,2024-08-29T08:26:00Z,2025-01-03T05:07:10Z,cs.CV,Healthcare_AI,T013,Early detection of Alzheimer’s disease using multimodal learning,http://arxiv.org/abs/2408.16343v2,all:early AND all:detection AND all:alzheimer AND all:disease AND all:multimodal
D0125,2310.16936v2,Diagnosing Alzheimer's Disease using Early-Late Multimodal Data Fusion with Jacobian Maps,"Alzheimer's disease (AD) is a prevalent and debilitating neurodegenerative disorder impacting a large aging population. Detecting AD in all its presymptomatic and symptomatic stages is crucial for early intervention and treatment. An active research direction is to explore machine learning methods that harness multimodal data fusion to outperform human inspection of medical scans. However, existing multimodal fusion models have limitations, including redundant computation, complex architecture, and simplistic handling of missing data. Moreover, the preprocessing pipelines of medical scans remain inadequately detailed and are seldom optimized for individual subjects. In this paper, we propose an efficient early-late fusion (ELF) approach, which leverages a convolutional neural network for automated feature extraction and random forests for their competitive performance on small datasets. Additionally, we introduce a robust preprocessing pipeline that adapts to the unique characteristics of individual subjects and makes use of whole brain images rather than slices or patches. Moreover, to tackle the challenge of detecting subtle changes in brain volume, we transform images into the Jacobian domain (JD) to enhance both accuracy and robustness in our classification. Using MRI and CT images from the OASIS-3 dataset, our experiments demonstrate the effectiveness of the ELF approach in classifying AD into four stages with an accuracy of 97.19%.",Yasmine Mustafa; Tie Luo,2023-10-25T19:02:57Z,2023-10-27T18:02:42Z,cs.CV,Healthcare_AI,T013,Early detection of Alzheimer’s disease using multimodal learning,http://arxiv.org/abs/2310.16936v2,all:early AND all:detection AND all:alzheimer AND all:disease AND all:multimodal
D0126,2512.18986v1,R-GenIMA: Integrating Neuroimaging and Genetics with Interpretable Multimodal AI for Alzheimer's Disease Progression,"Early detection of Alzheimer's disease (AD) requires models capable of integrating macro-scale neuroanatomical alterations with micro-scale genetic susceptibility, yet existing multimodal approaches struggle to align these heterogeneous signals. We introduce R-GenIMA, an interpretable multimodal large language model that couples a novel ROI-wise vision transformer with genetic prompting to jointly model structural MRI and single nucleotide polymorphisms (SNPs) variations. By representing each anatomically parcellated brain region as a visual token and encoding SNP profiles as structured text, the framework enables cross-modal attention that links regional atrophy patterns to underlying genetic factors. Applied to the ADNI cohort, R-GenIMA achieves state-of-the-art performance in four-way classification across normal cognition (NC), subjective memory concerns (SMC), mild cognitive impairment (MCI), and AD. Beyond predictive accuracy, the model yields biologically meaningful explanations by identifying stage-specific brain regions and gene signatures, as well as coherent ROI-Gene association patterns across the disease continuum. Attention-based attribution revealed genes consistently enriched for established GWAS-supported AD risk loci, including APOE, BIN1, CLU, and RBFOX1. Stage-resolved neuroanatomical signatures identified shared vulnerability hubs across disease stages alongside stage-specific patterns: striatal involvement in subjective decline, frontotemporal engagement during prodromal impairment, and consolidated multimodal network disruption in AD. These results demonstrate that interpretable multimodal AI can synthesize imaging and genetics to reveal mechanistic insights, providing a foundation for clinically deployable tools that enable earlier risk stratification and inform precision therapeutic strategies in Alzheimer's disease.",Kun Zhao; Siyuan Dai; Yingying Zhang; Guodong Liu; Pengfei Gu; Chenghua Lin; Paul M. Thompson; Alex Leow; Heng Huang; Lifang He; Liang Zhan; Haoteng Tang,2025-12-22T02:54:10Z,2025-12-22T02:54:10Z,cs.LG,Healthcare_AI,T013,Early detection of Alzheimer’s disease using multimodal learning,http://arxiv.org/abs/2512.18986v1,all:early AND all:detection AND all:alzheimer AND all:disease AND all:multimodal
D0127,2511.05106v1,Early Alzheimer's Disease Detection from Retinal OCT Images: A UK Biobank Study,"Alterations in retinal layer thickness, measurable using Optical Coherence Tomography (OCT), have been associated with neurodegenerative diseases such as Alzheimer's disease (AD). While previous studies have mainly focused on segmented layer thickness measurements, this study explored the direct classification of OCT B-scan images for the early detection of AD. To our knowledge, this is the first application of deep learning to raw OCT B-scans for AD prediction in the literature. Unlike conventional medical image classification tasks, early detection is more challenging than diagnosis because imaging precedes clinical diagnosis by several years. We fine-tuned and evaluated multiple pretrained models, including ImageNet-based networks and the OCT-specific RETFound transformer, using subject-level cross-validation datasets matched for age, sex, and imaging instances from the UK Biobank cohort. To reduce overfitting in this small, high-dimensional dataset, both standard and OCT-specific augmentation techniques were applied, along with a year-weighted loss function that prioritized cases diagnosed within four years of imaging. ResNet-34 produced the most stable results, achieving an AUC of 0.62 in the 4-year cohort. Although below the threshold for clinical application, our explainability analyses confirmed localized structural differences in the central macular subfield between the AD and control groups. These findings provide a baseline for OCT-based AD prediction, highlight the challenges of detecting subtle retinal biomarkers years before AD diagnosis, and point to the need for larger datasets and multimodal approaches.",Yasemin Turkan; F. Boray Tek; M. Serdar Nazlı; Öykü Eren,2025-11-07T09:46:05Z,2025-11-07T09:46:05Z,cs.CV,Healthcare_AI,T013,Early detection of Alzheimer’s disease using multimodal learning,http://arxiv.org/abs/2511.05106v1,all:early AND all:detection AND all:alzheimer AND all:disease AND all:multimodal
D0128,2412.09928v2,Leveraging Multimodal Methods and Spontaneous Speech for Alzheimer's Disease Identification,"Cognitive impairment detection through spontaneous speech is a promising avenue for early diagnosis of Alzheimer's disease (AD) and mild cognitive impairment (MCI), where timely intervention can significantly improve patient outcomes. The PROCESS Grand Challenge at ICASSP 2025 addresses these tasks by promoting innovative classification and regression methods for detecting cognitive decline. In this paper, we propose a multimodal fusion strategy that combines interpretable linguistic features with temporal embeddings extracted from pre-trained models. Our approach achieves an F1-score of 0.649 for the classification task (predicting healthy, MCI, dementia) and an RMSE of 2.628 for the regression task (MMSE score prediction), securing the top overall ranking in the competition.",Yifan Gao; Long Guo; Hong Liu,2024-12-13T07:28:31Z,2025-02-18T16:14:42Z,cs.SD,Healthcare_AI,T013,Early detection of Alzheimer’s disease using multimodal learning,http://arxiv.org/abs/2412.09928v2,all:early AND all:detection AND all:alzheimer AND all:disease AND all:multimodal
D0129,2511.22774v1,Alzheimer's Disease Prediction Using EffNetViTLoRA and BiLSTM with Multimodal Longitudinal MRI Data,"Alzheimer's disease (AD) is a prevalent neurodegenerative disorder that progressively impairs memory, decision-making, and overall cognitive function. As AD is irreversible, early prediction is critical for timely intervention and management. Mild Cognitive Impairment (MCI), a transitional stage between cognitively normal (CN) aging and AD, plays a significant role in early AD diagnosis. However, predicting MCI progression remains a significant challenge, as not all individuals with MCI convert to AD. MCI subjects are categorized into stable MCI (sMCI) and progressive MCI (pMCI) based on conversion status. In this study, we propose a generalized, end-to-end deep learning model for AD prediction using MCI cases from the Alzheimer's Disease Neuroimaging Initiative (ADNI). Our hybrid architecture integrates Convolutional Neural Networks and Vision Transformers to capture both local spatial features and global contextual dependencies from Magnetic Resonance Imaging (MRI) scans. To incorporate temporal progression, we further employ Bidirectional Long Short-Term Memory (BiLSTM) networks to process features extracted from four consecutive MRI timepoints along with some other non-image biomarkers, predicting each subject's cognitive status at month 48. Our multimodal model achieved an average progression prediction accuracy of 95.05\% between sMCI and pMCI, outperforming existing studies in AD prediction. This work demonstrates state-of-the-art performance in longitudinal AD prediction and highlights the effectiveness of combining spatial and temporal modeling for the early detection of Alzheimer's disease.",Mahdieh Behjat Khatooni; Mohsen Soryani,2025-11-27T21:53:23Z,2025-11-27T21:53:23Z,cs.CV,Healthcare_AI,T013,Early detection of Alzheimer’s disease using multimodal learning,http://arxiv.org/abs/2511.22774v1,all:early AND all:detection AND all:alzheimer AND all:disease AND all:multimodal
D0130,2511.18320v1,"Comprehensive Multimodal and Multiscale Analysis of Alzheimer Disease in 5xFAD Mice: Optical Spectroscopies, TEM, Neuropathological, and Behavioral Investigations","Alzheimer disease (AD) is considered one of the leading causes of death in the United States, and there is no effective cure for it. Understanding the neuropathological mechanisms underlying AD is essential for identifying early, reliable biomarkers and developing effective therapies. In this paper, we report on a comprehensive multimodal study of AD pathology using the 5xFAD mouse model. We employed light-scattering techniques, Partial Wave Spectroscopy (PWS) and Inverse Participation Ratio (IPR), to detect nanoscale structural alterations in brain tissues, nuclear components, and mitochondria. To support the light-scattering experiments, behavior, and histopathological studies were conducted. These analyses revealed significant increases in structural heterogeneity and mass density fluctuations in the brains of 5xFAD mice compared with Non-transgenic controls. Behavioral assessment demonstrated memory impairment in 5xFAD mice, reflected by a reduced recognition index. Histopathological analysis further revealed increased amyloid beta plaques and microglia activation in the hippocampus and cortex of 5xFAD mice compared with Non-transgenic controls. An increase in structural disorder within brain tissues can be attributed to higher mass density fluctuations, likely arising from macromolecular rearrangement driven by amyloid beta aggregation and neuroinflammatory responses as the disease progresses. Our findings suggest that PWS and IPR-derived metrics provide sensitive biophysical indicators of early cellular and subcellular disruption, offering potential as quantitative biomarkers for the detection and progression of AD.",Dhruvil Solanki; Ishmael Apachigawo; Sazzad Khan; Santanu Maity; Fatemah Alharthi; Samia Nasim; Mohammad Alizadeh Poshtiri; Fnu Sweety; Jiangfeng Xiao; Mohammad Moshahid Khan; Prabhakar Pradhan,2025-11-23T07:21:50Z,2025-11-23T07:21:50Z,physics.med-ph,Healthcare_AI,T013,Early detection of Alzheimer’s disease using multimodal learning,http://arxiv.org/abs/2511.18320v1,all:early AND all:detection AND all:alzheimer AND all:disease AND all:multimodal
D0131,1905.03218v1,MetaPred: Meta-Learning for Clinical Risk Prediction with Limited Patient Electronic Health Records,"In recent years, increasingly augmentation of health data, such as patient Electronic Health Records (EHR), are becoming readily available. This provides an unprecedented opportunity for knowledge discovery and data mining algorithms to dig insights from them, which can, later on, be helpful to the improvement of the quality of care delivery. Predictive modeling of clinical risk, including in-hospital mortality, hospital readmission, chronic disease onset, condition exacerbation, etc., from patient EHR, is one of the health data analytic problems that attract most of the interests. The reason is not only because the problem is important in clinical settings, but also there are challenges working with EHR such as sparsity, irregularity, temporality, etc. Different from applications in other domains such as computer vision and natural language processing, the labeled data samples in medicine (patients) are relatively limited, which creates lots of troubles for effective predictive model learning, especially for complicated models such as deep learning. In this paper, we propose MetaPred, a meta-learning for clinical risk prediction from longitudinal patient EHRs. In particular, in order to predict the target risk where there are limited data samples, we train a meta-learner from a set of related risk prediction tasks which learns how a good predictor is learned. The meta-learned can then be directly used in target risk prediction, and the limited available samples can be used for further fine-tuning the model performance. The effectiveness of MetaPred is tested on a real patient EHR repository from Oregon Health & Science University. We are able to demonstrate that with CNN and RNN as base predictors, MetaPred can achieve much better performance for predicting target risk with low resources comparing with the predictor trained on the limited samples available for this risk.",Xi Sheryl Zhang; Fengyi Tang; Hiroko Dodge; Jiayu Zhou; Fei Wang,2019-05-08T17:07:51Z,2019-05-08T17:07:51Z,cs.LG,Healthcare_AI,T014,Deep learning for clinical risk prediction from electronic health records,http://arxiv.org/abs/1905.03218v1,all:deep AND all:clinical AND all:risk AND all:prediction AND all:electronic
D0132,2604.01841v1,Retrieval-aligned Tabular Foundation Models Enable Robust Clinical Risk Prediction in Electronic Health Records Under Real-world Constraints,"Clinical prediction from structured electronic health records (EHRs) is challenging due to high dimensionality, heterogeneity, class imbalance, and distribution shift. While tabular in-context learning (TICL) and retrieval-augmented methods perform well on generic benchmarks, their behavior in clinical settings remains unclear. We present a multi-cohort EHR benchmark comparing classical, deep tabular, and TICL models across varying data scale, feature dimensionality, outcome rarity, and cross-cohort generalization. PFN-based TICL models are sample-efficient in low-data regimes but degrade under naive distance-based retrieval as heterogeneity and imbalance increase. We propose AWARE, a task-aligned retrieval framework using supervised embedding learning and lightweight adapters. AWARE improves AUPRC by up to 12.2% under extreme imbalance, with gains increasing with data complexity. Our results identify retrieval quality and retrieval-inference alignment as key bottlenecks for deploying tabular in-context learning in clinical prediction.",Minh-Khoi Pham; Thang-Long Nguyen Ho; Thao Thi Phuong Dao; Tai Tan Mai; Minh-Triet Tran; Marie E. Ward; Una Geary; Rob Brennan; Nick McDonald; Martin Crane; Marija Bezbradica,2026-04-02T09:56:17Z,2026-04-02T09:56:17Z,cs.AI,Healthcare_AI,T014,Deep learning for clinical risk prediction from electronic health records,http://arxiv.org/abs/2604.01841v1,all:deep AND all:clinical AND all:risk AND all:prediction AND all:electronic
D0133,2304.02780v2,A Transformer-Based Deep Learning Approach for Fairly Predicting Post-Liver Transplant Risk Factors,"Liver transplantation is a life-saving procedure for patients with end-stage liver disease. There are two main challenges in liver transplant: finding the best matching patient for a donor and ensuring transplant equity among different subpopulations. The current MELD scoring system evaluates a patient's mortality risk if not receiving an organ within 90 days. However, the donor-patient matching should also consider post-transplant risk factors, such as cardiovascular disease, chronic rejection, etc., which are all common complications after transplant. Accurate prediction of these risk scores remains a significant challenge. In this study, we used predictive models to solve the above challenges. Specifically, we proposed a deep-learning model to predict multiple risk factors after a liver transplant. By formulating it as a multi-task learning problem, the proposed deep neural network was trained to simultaneously predict the five post-transplant risks and achieve equal good performance by exploiting task-balancing techniques. We also proposed a novel fairness-achieving algorithm to ensure prediction fairness across different subpopulations. We used electronic health records of 160,360 liver transplant patients, including demographic information, clinical variables, and laboratory values, collected from the liver transplant records of the United States from 1987 to 2018. The model's performance was evaluated using various performance metrics such as AUROC and AUPRC. Our experiment results highlighted the success of our multitask model in achieving task balance while maintaining accuracy. The model significantly reduced the task discrepancy by 39%. Further application of the fairness-achieving algorithm substantially reduced fairness disparity among all sensitive attributes (gender, age group, and race/ethnicity) in each risk factor.",Can Li; Xiaoqian Jiang; Kai Zhang,2023-04-05T22:54:26Z,2024-03-01T05:59:29Z,cs.LG,Healthcare_AI,T014,Deep learning for clinical risk prediction from electronic health records,http://arxiv.org/abs/2304.02780v2,all:deep AND all:clinical AND all:risk AND all:prediction AND all:electronic
D0134,2208.10240v2,A Multimodal Transformer: Fusing Clinical Notes with Structured EHR Data for Interpretable In-Hospital Mortality Prediction,"Deep-learning-based clinical decision support using structured electronic health records (EHR) has been an active research area for predicting risks of mortality and diseases. Meanwhile, large amounts of narrative clinical notes provide complementary information, but are often not integrated into predictive models. In this paper, we provide a novel multimodal transformer to fuse clinical notes and structured EHR data for better prediction of in-hospital mortality. To improve interpretability, we propose an integrated gradients (IG) method to select important words in clinical notes and discover the critical structured EHR features with Shapley values. These important words and clinical features are visualized to assist with interpretation of the prediction outcomes. We also investigate the significance of domain adaptive pretraining and task adaptive fine-tuning on the Clinical BERT, which is used to learn the representations of clinical notes. Experiments demonstrated that our model outperforms other methods (AUCPR: 0.538, AUCROC: 0.877, F1:0.490).",Weimin Lyu; Xinyu Dong; Rachel Wong; Songzhu Zheng; Kayley Abell-Hart; Fusheng Wang; Chao Chen,2022-08-09T03:49:52Z,2023-05-09T16:54:31Z,cs.CL,Healthcare_AI,T014,Deep learning for clinical risk prediction from electronic health records,http://arxiv.org/abs/2208.10240v2,all:deep AND all:clinical AND all:risk AND all:prediction AND all:electronic
D0135,2106.11360v1,Hi-BEHRT: Hierarchical Transformer-based model for accurate prediction of clinical events using multimodal longitudinal electronic health records,"Electronic health records represent a holistic overview of patients' trajectories. Their increasing availability has fueled new hopes to leverage them and develop accurate risk prediction models for a wide range of diseases. Given the complex interrelationships of medical records and patient outcomes, deep learning models have shown clear merits in achieving this goal. However, a key limitation of these models remains their capacity in processing long sequences. Capturing the whole history of medical encounters is expected to lead to more accurate predictions, but the inclusion of records collected for decades and from multiple resources can inevitably exceed the receptive field of the existing deep learning architectures. This can result in missing crucial, long-term dependencies. To address this gap, we present Hi-BEHRT, a hierarchical Transformer-based model that can significantly expand the receptive field of Transformers and extract associations from much longer sequences. Using a multimodal large-scale linked longitudinal electronic health records, the Hi-BEHRT exceeds the state-of-the-art BEHRT 1% to 5% for area under the receiver operating characteristic (AUROC) curve and 3% to 6% for area under the precision recall (AUPRC) curve on average, and 3% to 6% (AUROC) and 3% to 11% (AUPRC) for patients with long medical history for 5-year heart failure, diabetes, chronic kidney disease, and stroke risk prediction. Additionally, because pretraining for hierarchical Transformer is not well-established, we provide an effective end-to-end contrastive pre-training strategy for Hi-BEHRT using EHR, improving its transferability on predicting clinical events with relatively small training dataset.",Yikuan Li; Mohammad Mamouei; Gholamreza Salimi-Khorshidi; Shishir Rao; Abdelaali Hassaine; Dexter Canoy; Thomas Lukasiewicz; Kazem Rahimi,2021-06-21T18:47:08Z,2021-06-21T18:47:08Z,cs.LG,Healthcare_AI,T014,Deep learning for clinical risk prediction from electronic health records,http://arxiv.org/abs/2106.11360v1,all:deep AND all:clinical AND all:risk AND all:prediction AND all:electronic
