doc_id,arxiv_id,title,abstract,authors,published,updated,primary_category,domain,topic_id,topic,source_url,query
D0244,2505.04846v1,HiPerRAG: High-Performance Retrieval Augmented Generation for Scientific Insights,"The volume of scientific literature is growing exponentially, leading to underutilized discoveries, duplicated efforts, and limited cross-disciplinary collaboration. Retrieval Augmented Generation (RAG) offers a way to assist scientists by improving the factuality of Large Language Models (LLMs) in processing this influx of information. However, scaling RAG to handle millions of articles introduces significant challenges, including the high computational costs associated with parsing documents and embedding scientific knowledge, as well as the algorithmic complexity of aligning these representations with the nuanced semantics of scientific content. To address these issues, we introduce HiPerRAG, a RAG workflow powered by high performance computing (HPC) to index and retrieve knowledge from more than 3.6 million scientific articles. At its core are Oreo, a high-throughput model for multimodal document parsing, and ColTrast, a query-aware encoder fine-tuning algorithm that enhances retrieval accuracy by using contrastive learning and late-interaction techniques. HiPerRAG delivers robust performance on existing scientific question answering benchmarks and two new benchmarks introduced in this work, achieving 90% accuracy on SciQ and 76% on PubMedQA-outperforming both domain-specific models like PubMedGPT and commercial LLMs such as GPT-4. Scaling to thousands of GPUs on the Polaris, Sunspot, and Frontier supercomputers, HiPerRAG delivers million document-scale RAG workflows for unifying scientific knowledge and fostering interdisciplinary innovation.",Ozan Gokdemir; Carlo Siebenschuh; Alexander Brace; Azton Wells; Brian Hsu; Kyle Hippe; Priyanka V. Setty; Aswathy Ajith; J. Gregory Pauloski; Varuni Sastry; Sam Foreman; Huihuo Zheng; Heng Ma; Bharat Kale; Nicholas Chia; Thomas Gibbs; Michael E. Papka; Thomas Brettin; Francis J. Alexander; Anima Anandkumar; Ian Foster; Rick Stevens; Venkatram Vishwanath; Arvind Ramanathan,2025-05-07T22:50:23Z,2025-05-07T22:50:23Z,cs.IR,Scientific_QA,T025,Retrieval-augmented question answering over scientific papers,http://arxiv.org/abs/2505.04846v1,all:retrieval AND all:augmented AND all:question AND all:answering AND all:scientific
D0245,2511.16283v1,MuISQA: Multi-Intent Retrieval-Augmented Generation for Scientific Question Answering,"Complex scientific questions often entail multiple intents, such as identifying gene mutations and linking them to related diseases. These tasks require evidence from diverse sources and multi-hop reasoning, while conventional retrieval-augmented generation (RAG) systems are usually single-intent oriented, leading to incomplete evidence coverage. To assess this limitation, we introduce the Multi-Intent Scientific Question Answering (MuISQA) benchmark, which is designed to evaluate RAG systems on heterogeneous evidence coverage across sub-questions. In addition, we propose an intent-aware retrieval framework that leverages large language models (LLMs) to hypothesize potential answers, decompose them into intent-specific queries, and retrieve supporting passages for each underlying intent. The retrieved fragments are then aggregated and re-ranked via Reciprocal Rank Fusion (RRF) to balance coverage across diverse intents while reducing redundancy. Experiments on both MuISQA benchmark and other general RAG datasets demonstrate that our method consistently outperforms conventional approaches, particularly in retrieval accuracy and evidence coverage.",Zhiyuan Li; Haisheng Yu; Guangchuan Guo; Nan Zhou; Jiajun Zhang,2025-11-20T12:03:36Z,2025-11-20T12:03:36Z,cs.AI,Scientific_QA,T025,Retrieval-augmented question answering over scientific papers,http://arxiv.org/abs/2511.16283v1,all:retrieval AND all:augmented AND all:question AND all:answering AND all:scientific
D0246,2501.15067v1,CG-RAG: Research Question Answering by Citation Graph Retrieval-Augmented LLMs,"Research question answering requires accurate retrieval and contextual understanding of scientific literature. However, current Retrieval-Augmented Generation (RAG) methods often struggle to balance complex document relationships with precise information retrieval. In this paper, we introduce Contextualized Graph Retrieval-Augmented Generation (CG-RAG), a novel framework that integrates sparse and dense retrieval signals within graph structures to enhance retrieval efficiency and subsequently improve generation quality for research question answering. First, we propose a contextual graph representation for citation graphs, effectively capturing both explicit and implicit connections within and across documents. Next, we introduce Lexical-Semantic Graph Retrieval (LeSeGR), which seamlessly integrates sparse and dense retrieval signals with graph encoding. It bridges the gap between lexical precision and semantic understanding in citation graph retrieval, demonstrating generalizability to existing graph retrieval and hybrid retrieval methods. Finally, we present a context-aware generation strategy that utilizes the retrieved graph-structured information to generate precise and contextually enriched responses using large language models (LLMs). Extensive experiments on research question answering benchmarks across multiple domains demonstrate that our CG-RAG framework significantly outperforms RAG methods combined with various state-of-the-art retrieval approaches, delivering superior retrieval accuracy and generation quality.",Yuntong Hu; Zhihan Lei; Zhongjie Dai; Allen Zhang; Abhinav Angirekula; Zheng Zhang; Liang Zhao,2025-01-25T04:18:08Z,2025-01-25T04:18:08Z,cs.IR,Scientific_QA,T025,Retrieval-augmented question answering over scientific papers,http://arxiv.org/abs/2501.15067v1,all:retrieval AND all:augmented AND all:question AND all:answering AND all:scientific
D0247,2601.16478v1,DeepEra: A Deep Evidence Reranking Agent for Scientific Retrieval-Augmented Generated Question Answering,"With the rapid growth of scientific literature, scientific question answering (SciQA) has become increasingly critical for exploring and utilizing scientific knowledge. Retrieval-Augmented Generation (RAG) enhances LLMs by incorporating knowledge from external sources, thereby providing credible evidence for scientific question answering. But existing retrieval and reranking methods remain vulnerable to passages that are semantically similar but logically irrelevant, often reducing factual reliability and amplifying hallucinations.To address this challenge, we propose a Deep Evidence Reranking Agent (DeepEra) that integrates step-by-step reasoning, enabling more precise evaluation of candidate passages beyond surface-level semantics. To support systematic evaluation, we construct SciRAG-SSLI (Scientific RAG - Semantically Similar but Logically Irrelevant), a large-scale dataset comprising about 300K SciQA instances across 10 subjects, constructed from 10M scientific corpus. The dataset combines naturally retrieved contexts with systematically generated distractors to test logical robustness and factual grounding. Comprehensive evaluations confirm that our approach achieves superior retrieval performance compared to leading rerankers. To our knowledge, this work is the first to comprehensively study and empirically validate innegligible SSLI issues in two-stage RAG frameworks.",Haotian Chen; Qingqing Long; Siyu Pu; Xiao Luo; Wei Ju; Meng Xiao; Yuanchun Zhou; Jianghua Zhao; Xuezhi Wang,2026-01-23T06:19:08Z,2026-01-23T06:19:08Z,cs.CL,Scientific_QA,T025,Retrieval-augmented question answering over scientific papers,http://arxiv.org/abs/2601.16478v1,all:retrieval AND all:augmented AND all:question AND all:answering AND all:scientific
D0248,2404.14760v2,Retrieval Augmented Generation for Domain-specific Question Answering,"Question answering (QA) has become an important application in the advanced development of large language models. General pre-trained large language models for question-answering are not trained to properly understand the knowledge or terminology for a specific domain, such as finance, healthcare, education, and customer service for a product. To better cater to domain-specific understanding, we build an in-house question-answering system for Adobe products. We propose a novel framework to compile a large question-answer database and develop the approach for retrieval-aware finetuning of a Large Language model. We showcase that fine-tuning the retriever leads to major improvements in the final generation. Our overall approach reduces hallucinations during generation while keeping in context the latest retrieval information for contextual grounding.",Sanat Sharma; David Seunghyun Yoon; Franck Dernoncourt; Dewang Sultania; Karishma Bagga; Mengjiao Zhang; Trung Bui; Varun Kotte,2024-04-23T05:51:45Z,2024-05-29T16:18:02Z,cs.CL,Scientific_QA,T025,Retrieval-augmented question answering over scientific papers,http://arxiv.org/abs/2404.14760v2,all:retrieval AND all:augmented AND all:question AND all:answering AND all:scientific
D0249,2602.13647v2,SF-RAG: Structure-Fidelity Retrieval-Augmented Generation for Academic Question Answering,"Efficient question-answering (QA) over extensive scientific literature is essential for evidence-based engineering decision-making. Retrieval-augmented generation (RAG) is increasingly applied to question-answering over long academic papers, where accurate evidence allocation under a fixed token budget is critical. However, existing approaches flatten papers into unstructured chunks, destroying the native hierarchical structure and forcing retrieval to operate in a disordered space. This produces fragmented contexts, misallocates tokens to non-evidential regions, and increases the reasoning burden for downstream language models.To address these issues, we propose SF-RAG, an RAG framework that treats the native hierarchical structure of academic papers as a low-entropy retrieval prior.SF-RAG first inherits the native hierarchy to construct a structure-fidelity index, which prevents entropy increase at the source.It then designs a path-guided retrieval mechanism that aligns query semantics to relevant sections and selects high relevance root-to-leaf paths under a fixed token budget, yielding compact, coherent, and low-entropy retrieval contexts.In contrast to existing RAG approaches, SF-RAG avoids entropy increase caused by destructive preprocessing and provides a native low-entropy structural basis for subsequent retrieval. We further introduce entropy-based structural diagnostics to quantify retrieval fragmentation and evidence allocation accuracy.Evaluations across three QA benchmarks show that SF-RAG significantly reduces retrieval fragmentation and improves evidence allocation. These structural benefits drive superior answer quality, establishing a scalable foundation for intelligent engineering document systems and future applications in technical specifications.",Rui Yu; Tianyi Wang; Ruixia Liu; Yinglong Wang,2026-02-14T07:40:09Z,2026-03-18T07:31:06Z,cs.IR,Scientific_QA,T025,Retrieval-augmented question answering over scientific papers,http://arxiv.org/abs/2602.13647v2,all:retrieval AND all:augmented AND all:question AND all:answering AND all:scientific
D0250,2601.21733v1,CE-GOCD: Central Entity-Guided Graph Optimization for Community Detection to Augment LLM Scientific Question Answering,"Large Language Models (LLMs) are increasingly used for question answering over scientific research papers. Existing retrieval augmentation methods often rely on isolated text chunks or concepts, but overlook deeper semantic connections between papers. This impairs the LLM's comprehension of scientific literature, hindering the comprehensiveness and specificity of its responses. To address this, we propose Central Entity-Guided Graph Optimization for Community Detection (CE-GOCD), a method that augments LLMs' scientific question answering by explicitly modeling and leveraging semantic substructures within academic knowledge graphs. Our approach operates by: (1) leveraging paper titles as central entities for targeted subgraph retrieval, (2) enhancing implicit semantic discovery via subgraph pruning and completion, and (3) applying community detection to distill coherent paper groups with shared themes. We evaluated the proposed method on three NLP literature-based question-answering datasets, and the results demonstrate its superiority over other retrieval-augmented baseline approaches, confirming the effectiveness of our framework.",Jiayin Lan; Jiaqi Li; Baoxin Wang; Ming Liu; Dayong Wu; Shijin Wang; Bing Qin; Guoping Hu,2026-01-29T13:53:44Z,2026-01-29T13:53:44Z,cs.CL,Scientific_QA,T025,Retrieval-augmented question answering over scientific papers,http://arxiv.org/abs/2601.21733v1,all:retrieval AND all:augmented AND all:question AND all:answering AND all:scientific
D0251,2202.02646v2,RerrFact: Reduced Evidence Retrieval Representations for Scientific Claim Verification,"Exponential growth in digital information outlets and the race to publish has made scientific misinformation more prevalent than ever. However, the task to fact-verify a given scientific claim is not straightforward even for researchers. Scientific claim verification requires in-depth knowledge and great labor from domain experts to substantiate supporting and refuting evidence from credible scientific sources. The SciFact dataset and corresponding task provide a benchmarking leaderboard to the community to develop automatic scientific claim verification systems via extracting and assimilating relevant evidence rationales from source abstracts. In this work, we propose a modular approach that sequentially carries out binary classification for every prediction subtask as in the SciFact leaderboard. Our simple classifier-based approach uses reduced abstract representations to retrieve relevant abstracts. These are further used to train the relevant rationale-selection model. Finally, we carry out two-step stance predictions that first differentiate non-relevant rationales and then identify supporting or refuting rationales for a given claim. Experimentally, our system RerrFact with no fine-tuning, simple design, and a fraction of model parameters fairs competitively on the leaderboard against large-scale, modular, and joint modeling approaches. We make our codebase available at https://github.com/ashishrana160796/RerrFact.",Ashish Rana; Deepanshu Khanna; Tirthankar Ghosal; Muskaan Singh; Harpreet Singh; Prashant Singh Rana,2022-02-05T21:52:45Z,2022-04-18T11:04:34Z,cs.CL,Scientific_QA,T026,Scientific claim verification using language models,http://arxiv.org/abs/2202.02646v2,all:scientific AND all:claim AND all:verification AND all:language
D0252,2506.04585v2,MuSciClaims: Multimodal Scientific Claim Verification,"Assessing scientific claims requires identifying, extracting, and reasoning with multimodal data expressed in information-rich figures in scientific literature. Despite the large body of work in scientific QA, figure captioning, and other multimodal reasoning tasks over chart-based data, there are no readily usable multimodal benchmarks that directly test claim verification abilities. To remedy this gap, we introduce a new benchmark MuSciClaims accompanied by diagnostics tasks. We automatically extract supported claims from scientific articles, which we manually perturb to produce contradicted claims. The perturbations are designed to test for a specific set of claim verification capabilities. We also introduce a suite of diagnostic tasks that help understand model failures. Our results show most vision-language models are poor (~0.3-0.5 F1), with even the best model only achieving 0.72 F1. They are also biased towards judging claims as supported, likely misunderstanding nuanced perturbations within the claims. Our diagnostics show models are bad at localizing correct evidence within figures, struggle with aggregating information across modalities, and often fail to understand basic components of the figure.",Yash Kumar Lal; Manikanta Bandham; Mohammad Saqib Hasan; Apoorva Kashi; Mahnaz Koupaee; Niranjan Balasubramanian,2025-06-05T02:59:51Z,2025-07-30T03:05:30Z,cs.CL,Scientific_QA,T026,Scientific claim verification using language models,http://arxiv.org/abs/2506.04585v2,all:scientific AND all:claim AND all:verification AND all:language
D0253,2010.11930v1,Scientific Claim Verification with VERT5ERINI,"This work describes the adaptation of a pretrained sequence-to-sequence model to the task of scientific claim verification in the biomedical domain. We propose VERT5ERINI that exploits T5 for abstract retrieval, sentence selection and label prediction, which are three critical sub-tasks of claim verification. We evaluate our pipeline on SCIFACT, a newly curated dataset that requires models to not just predict the veracity of claims but also provide relevant sentences from a corpus of scientific literature that support this decision. Empirically, our pipeline outperforms a strong baseline in each of the three steps. Finally, we show VERT5ERINI's ability to generalize to two new datasets of COVID-19 claims using evidence from the ever-expanding CORD-19 corpus.",Ronak Pradeep; Xueguang Ma; Rodrigo Nogueira; Jimmy Lin,2020-10-22T17:56:33Z,2020-10-22T17:56:33Z,cs.CL,Scientific_QA,T026,Scientific claim verification using language models,http://arxiv.org/abs/2010.11930v1,all:scientific AND all:claim AND all:verification AND all:language
D0254,2502.10003v1,SciClaimHunt: A Large Dataset for Evidence-based Scientific Claim Verification,"Verifying scientific claims presents a significantly greater challenge than verifying political or news-related claims. Unlike the relatively broad audience for political claims, the users of scientific claim verification systems can vary widely, ranging from researchers testing specific hypotheses to everyday users seeking information on a medication. Additionally, the evidence for scientific claims is often highly complex, involving technical terminology and intricate domain-specific concepts that require specialized models for accurate verification. Despite considerable interest from the research community, there is a noticeable lack of large-scale scientific claim verification datasets to benchmark and train effective models. To bridge this gap, we introduce two large-scale datasets, SciClaimHunt and SciClaimHunt_Num, derived from scientific research papers. We propose several baseline models tailored for scientific claim verification to assess the effectiveness of these datasets. Additionally, we evaluate models trained on SciClaimHunt and SciClaimHunt_Num against existing scientific claim verification datasets to gauge their quality and reliability. Furthermore, we conduct human evaluations of the claims in proposed datasets and perform error analysis to assess the effectiveness of the proposed baseline models. Our findings indicate that SciClaimHunt and SciClaimHunt_Num serve as highly reliable resources for training models in scientific claim verification.",Sujit Kumar; Anshul Sharma; Siddharth Hemant Khincha; Gargi Shroff; Sanasam Ranbir Singh; Rahul Mishra,2025-02-14T08:34:26Z,2025-02-14T08:34:26Z,cs.CL,Scientific_QA,T026,Scientific claim verification using language models,http://arxiv.org/abs/2502.10003v1,all:scientific AND all:claim AND all:verification AND all:language
D0255,2210.13777v1,SciFact-Open: Towards open-domain scientific claim verification,"While research on scientific claim verification has led to the development of powerful systems that appear to approach human performance, these approaches have yet to be tested in a realistic setting against large corpora of scientific literature. Moving to this open-domain evaluation setting, however, poses unique challenges; in particular, it is infeasible to exhaustively annotate all evidence documents. In this work, we present SciFact-Open, a new test collection designed to evaluate the performance of scientific claim verification systems on a corpus of 500K research abstracts. Drawing upon pooling techniques from information retrieval, we collect evidence for scientific claims by pooling and annotating the top predictions of four state-of-the-art scientific claim verification models. We find that systems developed on smaller corpora struggle to generalize to SciFact-Open, exhibiting performance drops of at least 15 F1. In addition, analysis of the evidence in SciFact-Open reveals interesting phenomena likely to appear when claim verification systems are deployed in practice, e.g., cases where the evidence supports only a special case of the claim. Our dataset is available at https://github.com/dwadden/scifact-open.",David Wadden; Kyle Lo; Bailey Kuehl; Arman Cohan; Iz Beltagy; Lucy Lu Wang; Hannaneh Hajishirzi,2022-10-25T05:45:00Z,2022-10-25T05:45:00Z,cs.CL,Scientific_QA,T026,Scientific claim verification using language models,http://arxiv.org/abs/2210.13777v1,all:scientific AND all:claim AND all:verification AND all:language
D0256,2506.06972v1,Atomic Reasoning for Scientific Table Claim Verification,"Scientific texts often convey authority due to their technical language and complex data. However, this complexity can sometimes lead to the spread of misinformation. Non-experts are particularly susceptible to misleading claims based on scientific tables due to their high information density and perceived credibility. Existing table claim verification models, including state-of-the-art large language models (LLMs), often struggle with precise fine-grained reasoning, resulting in errors and a lack of precision in verifying scientific claims. Inspired by Cognitive Load Theory, we propose that enhancing a model's ability to interpret table-based claims involves reducing cognitive load by developing modular, reusable reasoning components (i.e., atomic skills). We introduce a skill-chaining schema that dynamically composes these skills to facilitate more accurate and generalizable reasoning with a reduced cognitive load. To evaluate this, we create SciAtomicBench, a cross-domain benchmark with fine-grained reasoning annotations. With only 350 fine-tuning examples, our model trained by atomic reasoning outperforms GPT-4o's chain-of-thought method, achieving state-of-the-art results with far less training data.",Yuji Zhang; Qingyun Wang; Cheng Qian; Jiateng Liu; Chenkai Sun; Denghui Zhang; Tarek Abdelzaher; Chengxiang Zhai; Preslav Nakov; Heng Ji,2025-06-08T02:46:22Z,2025-06-08T02:46:22Z,cs.CL,Scientific_QA,T026,Scientific claim verification using language models,http://arxiv.org/abs/2506.06972v1,all:scientific AND all:claim AND all:verification AND all:language
D0257,2602.07621v2,SciClaimEval: Cross-modal Claim Verification in Scientific Papers,"We present SciClaimEval, a new scientific dataset for the claim verification task. Unlike existing resources, SciClaimEval features authentic claims, including refuted ones, directly extracted from published papers. To create refuted claims, we introduce a novel approach that modifies the supporting evidence (figures and tables), rather than altering the claims or relying on large language models (LLMs) to fabricate contradictions. The dataset provides cross-modal evidence with diverse representations: figures are available as images, while tables are provided in multiple formats, including images, LaTeX source, HTML, and JSON. SciClaimEval contains 1,664 annotated samples from 180 papers across three domains, machine learning, natural language processing, and medicine, validated through expert annotation. We benchmark 11 multimodal foundation models, both open-source and proprietary, across the dataset. Results show that figure-based verification remains particularly challenging for all models, as a substantial performance gap remains between the best system and human baseline.",Xanh Ho; Yun-Ang Wu; Sunisth Kumar; Tian Cheng Xia; Florian Boudin; Andre Greiner-Petter; Akiko Aizawa,2026-02-07T16:58:55Z,2026-02-13T11:36:02Z,cs.CL,Scientific_QA,T026,Scientific claim verification using language models,http://arxiv.org/abs/2602.07621v2,all:scientific AND all:claim AND all:verification AND all:language
D0258,2503.07937v1,LLM-based Corroborating and Refuting Evidence Retrieval for Scientific Claim Verification,"In this paper, we introduce CIBER (Claim Investigation Based on Evidence Retrieval), an extension of the Retrieval-Augmented Generation (RAG) framework designed to identify corroborating and refuting documents as evidence for scientific claim verification. CIBER addresses the inherent uncertainty in Large Language Models (LLMs) by evaluating response consistency across diverse interrogation probes. By focusing on the behavioral analysis of LLMs without requiring access to their internal information, CIBER is applicable to both white-box and black-box models. Furthermore, CIBER operates in an unsupervised manner, enabling easy generalization across various scientific domains. Comprehensive evaluations conducted using LLMs with varying levels of linguistic proficiency reveal CIBER's superior performance compared to conventional RAG approaches. These findings not only highlight the effectiveness of CIBER but also provide valuable insights for future advancements in LLM-based scientific claim verification.",Siyuan Wang; James R. Foulds; Md Osman Gani; Shimei Pan,2025-03-11T00:29:50Z,2025-03-11T00:29:50Z,cs.AI,Scientific_QA,T026,Scientific claim verification using language models,http://arxiv.org/abs/2503.07937v1,all:scientific AND all:claim AND all:verification AND all:language
