doc_id,arxiv_id,title,abstract,authors,published,updated,primary_category,domain,topic_id,topic,source_url,query
D0371,2507.12484v1,AI-Powered Math Tutoring: Platform for Personalized and Adaptive Education,"The growing ubiquity of artificial intelligence (AI), in particular large language models (LLMs), has profoundly altered the way in which learners gain knowledge and interact with learning material, with many claiming that AI positively influences their learning achievements. Despite this advancement, current AI tutoring systems face limitations associated with their reactive nature, often providing direct answers without encouraging deep reflection or incorporating structured pedagogical tools and strategies. This limitation is most apparent in the field of mathematics, in which AI tutoring systems remain underdeveloped. This research addresses the question: How can AI tutoring systems move beyond providing reactive assistance to enable structured, individualized, and tool-assisted learning experiences? We introduce a novel multi-agent AI tutoring platform that combines adaptive and personalized feedback, structured course generation, and textbook knowledge retrieval to enable modular, tool-assisted learning processes. This system allows students to learn new topics while identifying and targeting their weaknesses, revise for exams effectively, and practice on an unlimited number of personalized exercises. This article contributes to the field of artificial intelligence in education by introducing a novel platform that brings together pedagogical agents and AI-driven components, augmenting the field with modular and effective systems for teaching mathematics.",Jarosław A. Chudziak; Adam Kostka,2025-07-14T20:35:16Z,2025-07-14T20:35:16Z,cs.AI,Educational_AI,T038,LLM-based tutoring systems for adaptive education,http://arxiv.org/abs/2507.12484v1,all:llm AND all:tutoring AND all:adaptive AND all:education
D0372,2406.10934v1,Beyond Answers: Large Language Model-Powered Tutoring System in Physics Education for Deep Learning and Precise Understanding,"The integration of artificial intelligence (AI) in education has shown significant promise, yet the effective personalization of learning, particularly in physics education, remains a challenge. This paper proposes Physics-STAR, a framework for large language model (LLM)- powered tutoring system designed to address this gap by providing personalized and adaptive learning experiences for high school students. Our study evaluates Physics-STAR against traditional teacher-led lectures and generic LLM tutoring through a controlled experiment with 12 high school sophomores. Results showed that Physics-STAR increased students' average scores and efficiency on conceptual, computational, and on informational questions. In particular, students' average scores on complex information problems increased by 100% and their efficiency increased by 5.95%. By facilitating step-by-step guidance and reflective learning, Physics-STAR helps students develop critical thinking skills and a robust comprehension of abstract concepts. The findings underscore the potential of AI-driven personalized tutoring systems to transform physics education. As LLM continues to advance, the future of student-centered AI in education looks promising, with the potential to significantly improve learning outcomes and efficiency.",Zhoumingju Jiang; Mengjun Jiang,2024-06-16T13:31:35Z,2024-06-16T13:31:35Z,physics.ed-ph,Educational_AI,T038,LLM-based tutoring systems for adaptive education,http://arxiv.org/abs/2406.10934v1,all:llm AND all:tutoring AND all:adaptive AND all:education
D0373,2603.28062v1,SLOW: Strategic Logical-inference Open Workspace for Cognitive Adaptation in AI Tutoring,"While Large Language Models (LLMs) have demonstrated remarkable fluency in educational dialogues, most generative tutors primarily operate through intuitive, single-pass generation. This reliance on fast thinking precludes a dedicated reasoning workspace, forcing multiple diagnostic and strategic signals to be processed in a conflated manner. As a result, learner cognitive diagnosis, affective perception, and pedagogical decision-making become tightly entangled, which limits the tutoring system's capacity for deliberate instructional adaptation. We propose SLOW, a theory-informed tutoring framework that supports deliberate learner-state reasoning within a transparent decision workspace. Inspired by dual-process accounts of human tutoring, SLOW explicitly separates learner-state inference from instructional action selection. The framework integrates causal evidence parsing from learner language, fuzzy cognitive diagnosis with counterfactual stability analysis, and prospective affective reasoning to anticipate how instructional choices may influence learners' emotional trajectories. These signals are jointly considered to guide pedagogically and affectively aligned tutoring strategies. Evaluation using hybrid human-AI judgments demonstrates significant improvements in personalization, emotional sensitivity, and clarity. Ablation studies further confirm the necessity of each module, showcasing how SLOW enables interpretable and reliable intelligent tutoring through a visualized decision-making process. This work advances the interpretability and educational validity of LLM-based adaptive instruction.",Yuang Wei; Ruijia Li; Bo Jiang,2026-03-30T06:01:16Z,2026-03-30T06:01:16Z,cs.AI,Educational_AI,T038,LLM-based tutoring systems for adaptive education,http://arxiv.org/abs/2603.28062v1,all:llm AND all:tutoring AND all:adaptive AND all:education
D0374,2509.20372v1,AI-Guided Quantum Material Simulator for Education. Case Example: The Neuromorphic Materials Calculator 2025,"Teaching and learning in advanced materials science are often limited by two barriers: the technical complexity of quantum-mechanical simulations and the lack of individualized support in inquiry-based education. Here, we introduce the Neuromorphic Materials Calculator 2025 (NMC2025), a command-line platform that integrates a conversational artificial intelligence (AI) tutor with automated simulation workflows. NMC2025 combines large language model (LLM) guidance, real-time literature feedback, and domain-specific computation to create an adaptive learning environment. The system includes modular Python components for material discovery, simulation parameter optimization, and automated input generation for Quantum ESPRESSO (QE). Grounded in constructivist pedagogy, the tool enables students to carry out authentic research tasks such as identifying candidate materials for neuromorphic memristors or tuning density functional theory (DFT) inputs, while receiving context-aware explanations from the AI tutor. A case study illustrates how iterative, AI-guided refinement of hypotheses and calculations enhances both accuracy and understanding. NMC2025 fosters deeper conceptual insight, independent exploration, and smooth transfer of research methods into the classroom. This approach highlights the potential of AI-augmented education to reduce barriers to complex simulations and to expand access to computational modeling across science, technology, engineering, and mathematics (STEM).",Santiago D. Barrionuevo; Myriam H. Aguirre,2025-09-19T10:15:16Z,2025-09-19T10:15:16Z,physics.ed-ph,Educational_AI,T038,LLM-based tutoring systems for adaptive education,http://arxiv.org/abs/2509.20372v1,all:llm AND all:tutoring AND all:adaptive AND all:education
D0375,2503.06424v2,Training LLM-based Tutors to Improve Student Learning Outcomes in Dialogues,"Generative artificial intelligence (AI) has the potential to scale up personalized tutoring through large language models (LLMs). Recent AI tutors are adapted for the tutoring task by training or prompting LLMs to follow effective pedagogical principles, though they are not trained to maximize student learning throughout the course of a dialogue. Therefore, they may engage with students in a suboptimal way. We address this limitation by introducing an approach to train LLMs to generate tutor utterances that maximize the likelihood of student correctness, while still encouraging the model to follow good pedagogical practice. Specifically, we generate a set of candidate tutor utterances and score them using (1) an LLM-based student model to predict the chance of correct student responses and (2) a pedagogical rubric evaluated by GPT-4o. We then use the resulting data to train an open-source LLM, Llama 3.1 8B, using direct preference optimization. We show that tutor utterances generated by our model lead to significantly higher chances of correct student responses while maintaining the pedagogical quality of GPT-4o. We also conduct qualitative analyses and a human evaluation to demonstrate that our model generates high quality tutor utterances.",Alexander Scarlatos; Naiming Liu; Jaewook Lee; Richard Baraniuk; Andrew Lan,2025-03-09T03:38:55Z,2025-07-28T19:25:53Z,cs.CL,Educational_AI,T038,LLM-based tutoring systems for adaptive education,http://arxiv.org/abs/2503.06424v2,all:llm AND all:tutoring AND all:adaptive AND all:education
D0376,2512.23036v1,Problems With Large Language Models for Learner Modelling: Why LLMs Alone Fall Short for Responsible Tutoring in K--12 Education,"The rapid rise of large language model (LLM)-based tutors in K--12 education has fostered a misconception that generative models can replace traditional learner modelling for adaptive instruction. This is especially problematic in K--12 settings, which the EU AI Act classifies as high-risk domain requiring responsible design. Motivated by these concerns, this study synthesises evidence on limitations of LLM-based tutors and empirically investigates one critical issue: the accuracy, reliability, and temporal coherence of assessing learners' evolving knowledge over time. We compare a deep knowledge tracing (DKT) model with a widely used LLM, evaluated zero-shot and fine-tuned, using a large open-access dataset. Results show that DKT achieves the highest discrimination performance (AUC = 0.83) on next-step correctness prediction and consistently outperforms the LLM across settings. Although fine-tuning improves the LLM's AUC by approximately 8\% over the zero-shot baseline, it remains 6\% below DKT and produces higher early-sequence errors, where incorrect predictions are most harmful for adaptive support. Temporal analyses further reveal that DKT maintains stable, directionally correct mastery updates, whereas LLM variants exhibit substantial temporal weaknesses, including inconsistent and wrong-direction updates. These limitations persist despite the fine-tuned LLM requiring nearly 198 hours of high-compute training, far exceeding the computational demands of DKT. Our qualitative analysis of multi-skill mastery estimation further shows that, even after fine-tuning, the LLM produced inconsistent mastery trajectories, while DKT maintained smooth and coherent updates. Overall, the findings suggest that LLMs alone are unlikely to match the effectiveness of established intelligent tutoring systems, and that responsible tutoring requires hybrid frameworks that incorporate learner modelling.",Danial Hooshyar; Yeongwook Yang; Gustav Šíř; Tommi Kärkkäinen; Raija Hämäläinen; Mutlu Cukurova; Roger Azevedo,2025-12-28T18:26:22Z,2025-12-28T18:26:22Z,cs.AI,Educational_AI,T038,LLM-based tutoring systems for adaptive education,http://arxiv.org/abs/2512.23036v1,all:llm AND all:tutoring AND all:adaptive AND all:education
D0377,2502.05467v2,Position: LLMs Can be Good Tutors in English Education,"While recent efforts have begun integrating large language models (LLMs) into English education, they often rely on traditional approaches to learning tasks without fully embracing educational methodologies, thus lacking adaptability to language learning. To address this gap, we argue that LLMs have the potential to serve as effective tutors in English Education. Specifically, LLMs can play three critical roles: (1) as data enhancers, improving the creation of learning materials or serving as student simulations; (2) as task predictors, serving as learner assessment or optimizing learning pathway; and (3) as agents, enabling personalized and inclusive education. We encourage interdisciplinary research to explore these roles, fostering innovation while addressing challenges and risks, ultimately advancing English Education through the thoughtful integration of LLMs.",Jingheng Ye; Shen Wang; Deqing Zou; Yibo Yan; Kun Wang; Hai-Tao Zheng; Ruitong Liu; Zenglin Xu; Irwin King; Philip S. Yu; Qingsong Wen,2025-02-08T06:48:49Z,2025-09-06T20:45:10Z,cs.CL,Educational_AI,T038,LLM-based tutoring systems for adaptive education,http://arxiv.org/abs/2502.05467v2,all:llm AND all:tutoring AND all:adaptive AND all:education
D0378,2405.14713v1,Towards Educator-Driven Tutor Authoring: Generative AI Approaches for Creating Intelligent Tutor Interfaces,"Intelligent Tutoring Systems (ITSs) have shown great potential in delivering personalized and adaptive education, but their widespread adoption has been hindered by the need for specialized programming and design skills. Existing approaches overcome the programming limitations with no-code authoring through drag and drop, however they assume that educators possess the necessary skills to design effective and engaging tutor interfaces. To address this assumption we introduce generative AI capabilities to assist educators in creating tutor interfaces that meet their needs while adhering to design principles. Our approach leverages Large Language Models (LLMs) and prompt engineering to generate tutor layout and contents based on high-level requirements provided by educators as inputs. However, to allow them to actively participate in the design process, rather than relying entirely on AI-generated solutions, we allow generation both at the entire interface level and at the individual component level. The former provides educators with a complete interface that can be refined using direct manipulation, while the latter offers the ability to create specific elements to be added to the tutor interface. A small-scale comparison shows the potential of our approach to enhance the efficiency of tutor interface design. Moving forward, we raise critical questions for assisting educators with generative AI capabilities to create personalized, effective, and engaging tutors, ultimately enhancing their adoption.",Tommaso Calo; Christopher J. MacLellan,2024-05-23T15:46:10Z,2024-05-23T15:46:10Z,cs.HC,Educational_AI,T038,LLM-based tutoring systems for adaptive education,http://arxiv.org/abs/2405.14713v1,all:llm AND all:tutoring AND all:adaptive AND all:education
D0379,2603.23990v1,From Untamed Black Box to Interpretable Pedagogical Orchestration: The Ensemble of Specialized LLMs Architecture for Adaptive Tutoring,"Monolithic Large Language Models (LLMs) used in educational dialogue often behave as ""black boxes,"" where pedagogical decisions are implicit and difficult to audit, frequently violating instructional constraints by providing answers too early. We introduce the Ensemble of Specialized LLMS (ES-LLMS) architecture that separates decision-making from wording. Pedagogical actions are selected by a deterministic rules-based orchestrator coordinating specialized agents covering tutoring, assessment, feedback, scaffolding, motivation and ethics-guided by an interpretable Bayesian Knowledge Tracing (BKT) student model. An LLM renderer surface-realizes the chosen action in natural language. This design emphasizes reliability and controllability: constraints such as ""attempt-before-hint"" and hint caps are enforced as explicit rules, and the system logs per-turn agent traces and constraint checks. Validation of pedagogical quality via human expert reviewers (N=6) and a multi-LLM-as-Judge panel (six state-of-the-art models) showed that ES-LLMs were preferred in 91.7% and 79.2% of cases, respectively. The architecture significantly outperformed monolithic baselines across all seven dimensions, particularly in Scaffolding & Guidance, and Trust & Explainability. Furthermore, a Monte Carlo simulation (N=2,400) exposed a ""Mastery Gain Paradox,"" where monolithic tutors inflated short-term performance through over-assistance. In contrast, ES-LLMs achieved 100% adherence to pedagogical constraints (e.g., attempt-before-hint) and a 3.3x increase in hint efficiency. Operationally, ES-LLMs reduced costs by 54% and latency by 22% by utilizing stateless prompts. We conclude that structural decoupling is essential for transforming stochastic models into trustworthy, verifiable and resource-efficient pedagogical agents.",Nizam Kadir,2026-03-25T06:38:19Z,2026-03-25T06:38:19Z,cs.CY,Educational_AI,T038,LLM-based tutoring systems for adaptive education,http://arxiv.org/abs/2603.23990v1,all:llm AND all:tutoring AND all:adaptive AND all:education
D0380,2503.12479v1,Sakshm AI: Advancing AI-Assisted Coding Education for Engineering Students in India Through Socratic Tutoring and Comprehensive Feedback,"The advent of Large Language Models (LLMs) is reshaping education, particularly in programming, by enhancing problem-solving, enabling personalized feedback, and supporting adaptive learning. Existing AI tools for programming education struggle with key challenges, including the lack of Socratic guidance, direct code generation, limited context retention, minimal adaptive feedback, and the need for prompt engineering. To address these challenges, we introduce Sakshm AI, an intelligent tutoring system for learners across all education levels. It fosters Socratic learning through Disha, its inbuilt AI chatbot, which provides context-aware hints, structured feedback, and adaptive guidance while maintaining conversational memory and supporting language flexibility. This study examines 1170 registered participants, analyzing platform logs, engagement trends, and problem-solving behavior to assess Sakshm AI's impact. Additionally, a structured survey with 45 active users and 25 in-depth interviews was conducted, using thematic encoding to extract qualitative insights. Our findings reveal how AI-driven Socratic guidance influences problem-solving behaviors and engagement, offering key recommendations for optimizing AI-based coding platforms. This research combines quantitative and qualitative insights to inform AI-assisted education, providing a framework for scalable, intelligent tutoring systems that improve learning outcomes. Furthermore, Sakshm AI represents a significant step toward Sustainable Development Goal 4 Quality Education, providing an accessible and structured learning tool for undergraduate students, even without expert guidance. This is one of the first large-scale studies examining AI-assisted programming education across multiple institutions and demographics.",Raj Gupta; Harshita Goyal; Dhruv Kumar; Apurv Mehra; Sanchit Sharma; Kashish Mittal; Jagat Sesh Challa,2025-03-16T12:13:29Z,2025-03-16T12:13:29Z,cs.HC,Educational_AI,T038,LLM-based tutoring systems for adaptive education,http://arxiv.org/abs/2503.12479v1,all:llm AND all:tutoring AND all:adaptive AND all:education
D0381,2410.08058v1,Closing the Loop: Learning to Generate Writing Feedback via Language Model Simulated Student Revisions,"Providing feedback is widely recognized as crucial for refining students' writing skills. Recent advances in language models (LMs) have made it possible to automatically generate feedback that is actionable and well-aligned with human-specified attributes. However, it remains unclear whether the feedback generated by these models is truly effective in enhancing the quality of student revisions. Moreover, prompting LMs with a precise set of instructions to generate feedback is nontrivial due to the lack of consensus regarding the specific attributes that can lead to improved revising performance. To address these challenges, we propose PROF that PROduces Feedback via learning from LM simulated student revisions. PROF aims to iteratively optimize the feedback generator by directly maximizing the effectiveness of students' overall revising performance as simulated by LMs. Focusing on an economic essay assignment, we empirically test the efficacy of PROF and observe that our approach not only surpasses a variety of baseline methods in effectiveness of improving students' writing but also demonstrates enhanced pedagogical values, even though it was not explicitly trained for this aspect.",Inderjeet Nair; Jiaye Tan; Xiaotian Su; Anne Gere; Xu Wang; Lu Wang,2024-10-10T15:52:48Z,2024-10-10T15:52:48Z,cs.CL,Educational_AI,T039,Automatic feedback generation for student writing,http://arxiv.org/abs/2410.08058v1,all:automatic AND all:feedback AND all:student AND all:writing
D0382,2512.08596v1,Examining Student Interactions with a Pedagogical AI-Assistant for Essay Writing and their Impact on Students Writing Quality,"The dynamic nature of interactions between students and GenAI, as well as their relationship to writing quality, remains underexplored. While most research has examined how general-purpose GenAI can support writing, fewer studies have investigated how students interact with pedagogically designed systems across different phases of the writing process. To address this gap, we evaluated a GenAI-driven essay-writing assistant (EWA) designed to support higher education students in argumentative writing. Drawing on 1,282 interaction logs from 32 undergraduates during a two-hour writing session, Sequential Pattern Mining and K-Means clustering were used to identify behavioral patterns. Two clusters emerged: Cluster 1 emphasized outline planning and essay structure, while Cluster 2 focused on content development. A Mann-Whitney U test revealed a moderate effect size (r = 0.36) in the essay Organization dimension, with Cluster 1 showing higher scores. Qualitative analysis indicated that students with better performance actively wrote and shared essay sections with EWA for feedback, rather than interacted passively by asking questions. These findings suggest implications for teaching and system design. Teachers can encourage active engagement, while future EWAs may integrate automatic labeling and monitoring to prompt students to move from questioning to writing, enabling fuller benefits from GenAI-supported learning.",Wicaksono Febriantoro; Qi Zhou; Wannapon Suraworachet; Sahan Bulathwela; Andrea Gauthier; Eva Millan; Mutlu Cukurova,2025-12-09T13:34:33Z,2025-12-09T13:34:33Z,cs.CY,Educational_AI,T039,Automatic feedback generation for student writing,http://arxiv.org/abs/2512.08596v1,all:automatic AND all:feedback AND all:student AND all:writing
D0383,1908.01969v1,Word Embedding for Response-To-Text Assessment of Evidence,"Manually grading the Response to Text Assessment (RTA) is labor intensive. Therefore, an automatic method is being developed for scoring analytical writing when the RTA is administered in large numbers of classrooms. Our long-term goal is to also use this scoring method to provide formative feedback to students and teachers about students' writing quality. As a first step towards this goal, interpretable features for automatically scoring the evidence rubric of the RTA have been developed. In this paper, we present a simple but promising method for improving evidence scoring by employing the word embedding model. We evaluate our method on corpora of responses written by upper elementary students.",Haoran Zhang; Diane Litman,2019-08-06T05:58:06Z,2019-08-06T05:58:06Z,cs.CL,Educational_AI,T039,Automatic feedback generation for student writing,http://arxiv.org/abs/1908.01969v1,all:automatic AND all:feedback AND all:student AND all:writing
D0384,1206.6613v1,Semi-automatic Assessment Model of Student Texts - Pedagogical Foundations,This paper introduces the concept of the semi-automatic assessment of student texts that aims at offering the twin benefits of fully automatic grading and feedback together with the advantages that can be provided by human assessors. This paper concentrates on the pedagogical foundations of the model by demonstrating how the relevant findings in research into written composition and writing education have been taken into account in the model design.,T. Kakkonen; E. Sutinen,2012-06-28T10:03:11Z,2012-06-28T10:03:11Z,cs.CY,Educational_AI,T039,Automatic feedback generation for student writing,http://arxiv.org/abs/1206.6613v1,all:automatic AND all:feedback AND all:student AND all:writing
D0385,2311.09389v1,Neural machine translation for automated feedback on children's early-stage writing,"In this work, we address the problem of assessing and constructing feedback for early-stage writing automatically using machine learning. Early-stage writing is typically vastly different from conventional writing due to phonetic spelling and lack of proper grammar, punctuation, spacing etc. Consequently, early-stage writing is highly non-trivial to analyze using common linguistic metrics. We propose to use sequence-to-sequence models for ""translating"" early-stage writing by students into ""conventional"" writing, which allows the translated text to be analyzed using linguistic metrics. Furthermore, we propose a novel robust likelihood to mitigate the effect of noise in the dataset. We investigate the proposed methods using a set of numerical experiments and demonstrate that the conventional text can be predicted with high accuracy.",Jonas Vestergaard Jensen; Mikkel Jordahn; Michael Riis Andersen,2023-11-15T21:32:44Z,2023-11-15T21:32:44Z,cs.CL,Educational_AI,T039,Automatic feedback generation for student writing,http://arxiv.org/abs/2311.09389v1,all:automatic AND all:feedback AND all:student AND all:writing
